<?xml version="1.0" encoding="UTF-8"?>
<!DOCTYPE receta [
<!ELEMENT receta (title, image, ingredients, times, steps)>
<!ELEMENT title (#PCDATA)>
<!ELEMENT image EMPTY>
<!ATTLIST image alt CDATA #REQUIRED
              src CDATA #REQUIRED>
<!ELEMENT ingredients (ingredient+)>
<!ELEMENT ingredient (#PCDATA)>
<!ELEMENT times (time+)>
<!ELEMENT time (#PCDATA)>
<!ELEMENT steps (step+)>
<!ELEMENT step (#PCDATA)>
]>
<receta>
  <title>Calabacines rellenos de arroz negro y calabaza</title>
  <image alt="calabacines" src="calabacines.jpg"/>
  <ingredients>
    <ingredient>4 calabacines medianos</ingredient>
    <ingredient>1 taza de arroz negro</ingredient>
    <ingredient>2 tazas de caldo de verduras</ingredient>
    <ingredient>1 cebolla picada</ingredient>
    <ingredient>2 dientes de ajo picados</ingredient>
    <ingredient>1 taza de calabaza pelada y cortada en cubos peque√±os</ingredient>
    <ingredient>1/2 taza de tomates secos hidratados y picados</ingredient>
    <ingredient>1/4 taza de aceitunas negras picadas</ingredient>
    <ingredient>1 cucharada de alcaparras picadas</ingredient>
    <ingredient>1 cucharada de aceite de oliva</ingredient>
    <ingredient>Sal y pimienta al gusto</ingredient>
  </ingredients>
  <times>
    <time>Preparaci√≥n: 30 minutos</time>
    <time>Cocinar: 1 hora y 15 minutos</time>
    <time>Total: 1 hora y 45 minutos</time>
  </times>
  <steps>
    <step>Corta la parte superior de los calabacines y vac√≠a su interior con una cuchara. Reserva la pulpa del calabac√≠n.</step>
    <step>Lava el arroz negro con agua fr√≠a y cu√©celo en una cazuela con el caldo de verduras durante unos 45 minutos o hasta que est√© tierno. Escurre y reserva.</step>
    <step>Pon una sart√©n a fuego medio con aceite de oliva y a√±ade la cebolla y el ajo. Sofr√≠e hasta que la cebolla est√© transparente.</step>
    <step>Agrega la pulpa del calabac√≠n y la calabaza a la sart√©n y cocina durante 10 minutos.</step>
    <step>Agrega los tomates secos, las aceitunas y las alcaparras y cocina durante 5 minutos m√°s.</step>
    <step>Mezcla el arroz negro con el sofrito de verduras y sazona con sal y pimienta al gusto.</step>
    <step>Rellena los calabacines con la mezcla de arroz y verduras y col√≥calos en una bandeja para hornear. Si sobra mezcla de arroz, puedes servirla como acompa√±amiento.</step>
    <step>Tapa los calabacines con su parte superior y hornea a 180¬∞C durante 1 hora.</step>
    <step>Retira del horno y deja reposar durante unos minutos antes de servir.</step>
    <step>DISFRUTAR!!!! üòãüòãüòã</step>
  </steps>
</receta>
